{
  "status": 200,
  "statusText": "Ok",
  "httpVersion": "HTTP 1.1",
  "redirectURL": "",
  "headersSize": 50,
  "bodySize": 200,
  "cookies": [],
  "headers": [
    {
      "name": "Content-Length",
      "value": "10"
    }
  ],
  "content": {
    "text": "[RESPONSE CONTENT]",
    "size": 10,
    "mimeType": "application/json"
  }
}
